44,"[u'third', u'ton', u'seminars', u'blonde', u'son', u'flavour', u'dies', u'adviser', u'team', u'cases', u'values', u'muay', u'obsession', u'advance', u'sounds', u'thai', u'illness', u'ssris', u'sciences', u'shot', u'anyways', u'concern', u'pok', u'blessing', u'reminder', u'changing', u'internship', u'tuition', u'outlook', u'autoimmune', u'intro', u'full', u'relaxation', u'options', u'court', u'productivity', u'bless', u'really', u'paranoia', u'circle', u'mountain', u'extracurriculars', u'mirror', u'scale', u'dating', u'girlfriends', u'nap', u'subreddit', u'existent', u'breakup', u'afm', u'holiday', u'ece', u'intentions', u'chances', u'roommates', u'lazy', u'discrimination', u'graphics', u'recommendation']"
45,"[u'want', u'keep', u'law', u'basketball', u'hrs', u'lots', u'country', u'yes', u'mediocre', u'felt', u'word', u'pms', u'agent', u'grandma', u'middle', u'acquaintances', u'ability', u'vball', u'shrooms', u'list', u'past', u'pass', u'zone', u'none', u'dough', u'perfume', u'activity', u'wow', u'league', u'determination', u'drinking', u'tunnel', u'geez', u'stand', u'addiction', u'min', u'routine']"
46,"[u'worth', u'haze', u'china', u'aka', u'minority', u'attempt', u'affairs', u'latter', u'phase', u'grave', u'fucks', u'uw_secret_throwaway', u'nogf', u'bad', u'roller', u'conference', u'cools', u'mic', u'humanity', u'signal', u'understand', u'individuals', u'cliche', u'presence', u'assessment', u'fell', u'charge', u'sign', u'cservices', u'suck', u'truck', u'challenges', u'insanity', u'impressions', u'hackathons', u'notice', u'hybrids', u'direction', u'eid', u'consultation', u'halfway', u'versa', u'test', u'calmer', u'sides', u'valley', u'card', u'gifts', u'deadline', u'multitude', u'component', u'fergus', u'pac', u'wimbledon', u'needless', u'wager', u'gals', u'donor', u'sector', u'connections', u'startup', u'flies', u'indefinite', u'strategy', u'compromises', u'alongside', u'guide', u'rip', u'cup', u'inclination', u'sub', u'highlight', u'income', u'makes', u'win', u'notebook', u'ambassadors', u'mimiviruses', u'vagina', u'pd1', u'props', u'ohip', u'triples', u'tailspin', u'wall', u'outsider', u'smoking', u'publicize', u'moments', u'capabilities', u'january', u'footage', u'happens', u'esp', u'statement', u'brand', u'goodness', u'stat']"
47,"[u'votes', u'errors', u'experimentalist', u'grief', u'mt', u'fever', u'undergoing', u'reader', u'chill', u'shitty', u'specific', u'remind', u'soo', u'procrastinator', u'pmc', u'prescriptions', u'hairs', u'market', u'heard', u'acceptances', u'still', u'eccentricities', u'matches', u'pills', u'rink', u'professional', u'stretch', u'policies', u'cigs', u'solve', u'pile', u'act', u'presentation', u'fan', u'functioning', u'search', u'door', u'stick', u'history', u'buzzword', u'september', u'pray', u'yo', u'difficulty', u'ragrets', u'celebrities', u'meal', u'threaten', u'fire', u'cleaning', u'me115', u'emergency', u'bf', u'bb', u'cif', u'flow', u'single', u'naw', u'scrub', u'structure', u'lane', u'vehicles', u'kickstarter', u'registrars', u'tickles', u'stomach', u'error', u'shitstorm', u'yay', u'pauls', u'tumblr', u'swimming', u'spiral', u'ece105', u'repeat']"
48,"[u'whatsoever', u'second', u'homie', u'fellas', u'eventually', u'laysdays', u'academia', u'sorts', u'relative', u'planner', u'cant', u'piazza', u'opinions', u'dreams', u'afterwards', u'thinking', u'pounds', u'airline', u'ad', u'strain', u'notify', u'art', u'bare', u'pictures', u'checkboxes', u'rainbows', u'downhill', u'talent', u'suiciidality', u'employer', u'taking', u'partner', u'scent', u'bitches', u'spell', u'boom', u'alright']"
49,"[u'remorse', u'faster', u'ideation', u'crippling', u'ya', u'sluggishness', u'location', u'gf', u'pdst', u'truth', u'messenger', u'videogames', u'stats', u'stay']"
