0,"[u'school', u'work', u'life', u'things', u'night', u'people', u'way', u'time', u'term', u'year', u'thing', u'week', u'someone', u'health', u'person', u'services', u'something', u'day', u'job', u'friends']"
1,"[u'days', u'anxiety', u'mind', u'everything', u'shit', u'coop', u'exams', u'today', u'effort', u'stress', u'years', u'course', u'group', u'one', u'anyone', u'friend', u'situation', u'doctor', u'op', u'lot', u'program', u'hours', u'experience', u'family', u'hour', u'help', u'courses', u'everyone', u'idea', u'reason', u'student', u'part', u'kind', u'nothing', u'point', u'parents', u'bit', u'prof', u'anything', u'assignments', u'problems', u'depression', u'others', u'university', u'math', u'times', u'class', u'exam', u'co', u'cs', u'home']"
2,"[u'study', u'end', u'weeks', u'side', u'classes', u'feeling', u'com', u'success', u'thoughts', u'grades', u'thanks', u'months', u'support', u'weekend', u'marks', u'fuck', u'man', u'ones', u'interview', u'care', u'place', u'average', u'morning', u'jobs', u'mom', u'world', u'luck', u'students', u'month', u'gt', u'meditation', u'sense', u'advice', u'try', u'interviews', u'relationship', u'motivation', u'feels', u'case', u'counselling', u'uw', u'issues', u'resources', u'notes', u'degree', u'waterloo', u'bed', u'fact', u'stuff', u'book', u'campus', u'problem']"
3,"[u'sleep', u'sorry', u'music', u'counseling', u'coffee', u'therapy', u'solution', u'resume', u'top', u'matter', u'adhd', u'peers', u'midterms', u'reddit', u'terms', u'games', u'antidepressants', u'post', u'attacks', u'medication', u'environment', u'minute', u'share', u'date', u'maybe', u'talk', u'counsellor', u'yeah', u'future', u'engineering', u'money', u'treatment', u'mood', u'start', u'energy', u'activities', u'appointment', u'perspective', u'etc', u'company', u'science', u'hell', u'symptoms', u'habits', u'feel', u'number', u'self', u'experiences', u'plan', u'please', u'let', u'fun', u'yesterday', u'moment', u'questions', u'projects', u'meds', u'confidence', u'midterm', u'process', u'bunch', u'hesitate', u'system', u'need', u'brain', u'thought', u'position', u'happiness', u'edit', u'schedule']"
4,"[u'councillors', u'fifties']"
5,"[u'wednesday', u'concepts', u'amazement', u'listen', u'deserving', u'pharmacy', u'standards', u'transplant', u'dude', u'definitions', u'episodes', u'living', u'gen', u'semesters', u'buddies', u'videos', u'building', u'counselors', u'tv', u'action', u'binders', u'notch', u'pretty', u'emails', u'likes', u'advise', u'frosh', u'planet', u'pencil', u'prognosis', u'notebooks', u'state', u'accident', u'whatever', u'editing']"
6,"[u'buddy', u'holy', u'starts', u'scenario', u'impostor', u'guidance', u'fail', u'im', u'breaks', u'pain', u'needles', u'reality', u'majors', u'stream', u'pure', u'track', u'shopping', u'lady', u'psychologist', u'faculty', u'media', u'streaking', u'evaluation', u'gpa', u'holidays', u'pet', u'step', u'figure', u'procrastination', u'outline', u'males', u'harder', u'well', u'record']"
7,"[u'net', u'classmates', u'guilt', u'mins', u'reset', u'bullet', u'dosage', u'map', u'tears', u'stops', u'immigrate', u'deserve', u'store', u'concentration', u'processing', u'fortenshi', u'threat', u'gray', u'lost']"
8,"[u'skills', u'feelings', u'browse', u'type', u'example', u'expectations', u'break', u'effects', u'god', u'appointments', u'struggle', u'gym', u'toronto', u'season', u'best', u'amount', u'hand', u'www', u'right', u'focus', u'ice', u'suicide', u'trouble', u'groups', u'wait', u'https', u'heart', u'winter', u'get', u'afternoon', u'half', u'city', u'counselor', u'good', u'events', u'summer', u'tomorrow', u'oh', u'graduate', u'field', u'difference', u'material', u'respect', u'airport', u'harm', u'friday', u'guess', u'towards', u'tips', u'writer', u'practice', u'damn', u'look', u'read', u'assignment', u'graduation', u'question', u'warning', u'go', u'facebook', u'video', u'exercise', u'sort', u'hobby', u'front', u'cause', u'nobody', u'visa', u'places', u'view', u'computer', u'progress', u'walk', u'value', u'http', u'desk', u'paper', u'goals', u'minutes', u'girl']"
9,"[u'doubts', u'insecurity', u'answer', u'lump', u'feedback', u'acme', u'doc', u'july', u'nature', u'speeches', u'split', u'omg', u'escape', u'bottom', u'dick', u'variable', u'turns', u'cost', u'boost', u'teacher', u'guarantee', u'tries', u'weekdays', u'freshman', u'transfusions', u'twin', u'instrument', u'mon', u'sanity', u'asap', u'loathe', u'parties', u'loo', u'ticket', u'csc', u'feelsgoodman', u'hamsters', u'condolences', u'lie', u'geomatics', u'java', u'engg', u'development', u'partition', u'chat', u'melodrama', u'depressant', u'honestly', u'delay', u'exclusion', u'pussy', u'mode', u'ionic', u'playlist', u'kings', u'transfusion', u'tumbler', u'like', u'sexists', u'freedom', u'notices', u'status']"
10,"[u'rec', u'pace', u'toll', u'cali', u'intake', u'memorization', u'fall', u'imo', u'kid', u'subject', u'ira', u'speak', u'interest', u'programs', u'game', u'contact', u'yea', u'clubs', u'despair', u'check', u'concept', u'advantage', u'cool', u'level', u'findings', u'makeup', u'love', u'sports', u'trump', u'topic', u'requirements', u'non', u'killer', u'ideas', u'dream', u'slope', u'learn', u'salutation', u'reading', u'period', u'arts', u'inability', u'ccf', u'business', u'lol', u'evenings', u'lack', u'ta', u'condition', u'rate', u'emotions', u'information', u'plans', u'treatments', u'fb', u'responsibility', u'friendship', u'beginning', u'sometimes', u'sex', u'ptsd', u'back', u'mighty', u'run', u'bc', u'poster', u'e', u'code', u'power', u'fine', u'meet', u'distractions', u'links', u'poetry', u'software', u'dad', u'hands', u'management', u'interests', u'youtube', u'chicken', u'eyes', u'mistakes', u'construction', u'wise', u'kinds']"
11,"[u'eng', u'office', u'strength', u'basis', u'steps', u'deal', u'form', u'thank', u'miles', u'psychiatrist', u'ways', u'mark', u'food', u'forget', u'mental', u'research', u'ass', u'pm', u'cuz', u'results', u'body', u'mindset', u'pressure', u'lt', u'articles', u'aww']"
12,"[u'gov', u'already', u'thereof', u'butter', u'antidepressant', u'yee', u'tricking', u'uniform', u'allowed', u'eyeballs', u'cars', u'marijuana', u'comp', u'tower', u'misery', u'mall', u'funding', u'hnng', u'fianc', u'paranoid', u'regardless', u'blankets', u'authority', u'bloodwork', u'york', u'drinker', u'heightens', u'dreariness', u'mishap', u'kygo', u'gay']"
13,"[u'risk', u'timers', u'jesus', u'girls', u'super', u'_____', u'reply', u'randoms', u'dinner', u'strengths', u'rmb', u'pop', u'ukulele', u'cancer', u'kickass', u'occasions', u'fancy', u'context', u'bill', u'loop', u'funny', u'cell', u'account', u'sis', u'degrees', u'lucky', u'hmm', u'convey', u'stories']"
14,"[u'kids', u'vitamin', u'candidate', u'failure', u'crisis', u'may', u'show', u'beginners', u'cream', u'song', u'complain', u'travelling', u'disorder', u'advisor', u'quality', u'face']"
15,"[u'nail', u'friendships', u'trillogy', u'hold', u'renison', u'mumbo', u'likelyhood', u'noogler', u'sun', u'claws', u'climate', u'waterlooworks', u'neat', u'surround', u'update', u'manager', u'chair', u'hannah', u'p', u'formula', u'possibility', u'lmao', u'correlation', u'dates', u'countless', u'recorder', u'choo', u'teeth', u'mistborn', u'kiosks', u'grande', u'forgotten', u'headway', u'rid', u'achievers', u'hometown', u'supervisor', u'didnt', u'clarkson', u'route', u'priority', u'torment', u'agency', u'positivity', u'agreed', u'figures', u'stores', u'bell', u'works', u'saddens']"
16,"[u'even', u'supporters', u'room', u'regrets', u'think', u'meat', u'dsm', u'gripe', u'plenty', u'episode', u'alumni', u'downtime', u'testing', u'make', u'ditto', u'tonne', u'role', u'shallit', u'bs', u'car', u'nighters', u'bursaries', u'rock', u'deprivation', u'hematologist', u'proud', u'cannot', u'turkey', u'sentraline', u'comparison', u'cambridge', u'technically', u'bitchwork', u'trash', u'investment', u'knows', u'response', u'doctors', u'chart', u'relation', u'intelligence', u'barely', u'rewrite', u'pack', u'skype', u'stack', u'anybody', u'shape', u'hates', u'fucking', u'pen', u'bruh', u'mock', u'users', u'visits', u'meaning', u'suffers', u'engage', u'arrangement', u'slides', u'receptionist', u'fixes', u'poem', u'waste', u'alot', u'canadians', u'tests', u'scares', u'champ', u'conclusion']"
17,"[u'chem', u'saved', u'would', u'shoot', u'amazing', u'fit', u'quieter', u'effectiveness', u'observer', u'balance', u'survival', u'accomplishments', u'panacea', u'daddy', u'elon', u'posts', u'brother', u'targets', u'till', u'sf', u'tendency', u'facility', u'runners', u'brains', u'urge', u'worries', u'college', u'satisfaction', u'engine', u'many', u'speed', u'pomodoro_technique', u'poor', u'fac', u'broke', u'foot', u'coping', u'drink', u'boulder', u'sunny', u'actions', u'platelet', u'meeting', u'pillar', u'continue', u'ahhh', u'essay', u'women', u'surface', u'great', u'move', u'sia', u'society', u'put', u'impostor_syndrome', u'spirits', u'chapters', u'career', u'parts', u'never', u'skill', u'web', u'page', u'surge', u'loner', u'apps', u'periods', u'recommendations']"
18,"[u'appetite', u'vulnerability', u'asses', u'mm', u'summarize', u'gwen', u'fri', u'physician', u'pd20', u'fight', u'row', u'ttc', u'gta', u'workload', u'trauma', u'turd', u'ironically', u'outlet', u'boundaries', u'anti', u'learning', u'greetings', u'omega', u'castles', u'threads', u'elpe', u'quantum', u'center', u'marriage', u'coops', u'bonus', u'warnings', u'onenote', u'failures', u'therapists', u'poverty', u'dao', u'invitations', u'res', u'effect', u'onwards']"
19,"[u'pride', u'enjoy', u'advisers', u'machines', u'hospital', u'routines', u'addict', u'attempts', u'bonuses', u'boring', u'iirc', u'tolerance', u'dota', u'jest', u'toaster', u'war', u'derealization', u'roll', u'eternity', u'disorders', u'sigh', u'favour', u'water', u'prove', u'cav', u'cat', u'troubles', u'drop', u'programming', u'miley', u'profiles', u'purse', u'aura', u'bitch', u'politics', u'ign', u'endeavors', u'clique', u'libido', u'velocity', u'owen', u'anymore', u'reel', u'ambience', u'ties', u'achievements', u'organ', u'mornings', u'tend', u'javascript', u'afaik', u'helpline', u'employment']"
20,"[u'tole', u'arms', u'household', u'cmha', u'medicine', u'knit', u'clarity', u'supplementation', u'trust', u'yep', u'differences', u'dance', u'trial', u'curriculum', u'window', u'language', u'yup', u'cheesy', u'cornwall', u'blacklist', u'hockey', u'math239', u'screen', u'pan', u'relies', u'phys115', u'barbells', u'pockets', u'spicy', u'complete', u'examine', u'idiot', u'accessability', u'safety', u'supplements', u'athletics', u'reactions', u'benefits', u'passed', u'boredom', u'set', u'corruption', u'stat231', u'letter', u'ontario', u'occupy', u'invite', u'wheeeeee', u'jeez', u'philosophy', u'references', u'phdcomics', u'afraid', u'subscribe', u'pdf', u'fighting', u'sufferings', u'trap', u'transfer', u'gene', u'hr', u'eat']"
21,"[u'propane', u'motivate', u'content', u'psychologists', u'union', u'smash', u'hang', u'umm', u'periodic', u'np', u'sessions', u'st', u'remainder', u'workshops', u'expectation', u'bowl', u'rest', u'rules', u'competition', u'passions', u'image', u'af', u'introspection', u'numbing', u'apartment', u'volunteer', u'id755164884', u'reclusion', u'cheer', u'particle', u'disclosure', u'department', u'cordova', u'use', u'started', u'practicing', u'labor', u'affective', u'stride', u'placement', u'means', u'bondi', u'undergrad', u'avg', u'husk', u'assuming', u'hitter', u'piece']"
22,"[u'hate', u'campaign', u'haha', u'phone', u'join', u'order', u'mean', u'grade', u'boyfriend', u'report', u'result', u'hopefully', u'cycle', u'head', u'us', u'guy', u'change', u'studies', u'club', u'name', u'hurts', u'profs', u'worry', u'death', u'_', u'hobbies', u'finals', u'issue', u'semester', u'suggestions', u'story', u'performances', u'factor', u'mine', u'levels', u'amp', u'couple', u'conversation', u'purpose', u'hey', u'studying', u'hope', u'areas', u'email', u'education']"
23,"[u'saturday', u'news', u'pity', u'logic', u'dropboxes', u'thru', u'twenties', u'wanders', u'pay', u'regard', u'sadness', u'attitude', u'kw', u'crispr', u'matters', u'pros', u'rut', u'control', u'panic', u'choose', u'ball', u'liking']"
24,"[u'consistent', u'children', u'relax', u'hole', u'actuality', u'service', u'engagement', u'bridge', u'demoralizing', u'dog', u'fields', u'boss', u'locations', u'babies', u'trucks', u'ops', u'somehow', u'christmas', u'spring', u'notepad', u'skin', u'drinks', u'filler', u'making', u'eg', u'pre', u'cymbalta', u'dread', u'drive', u'sound', u'psychiatrists', u'momentum', u'superiority', u'rush', u'pulp', u'tackle', u'chinese', u'lawyer', u'hamster', u'shits', u'town', u'proxy', u'nights', u'pneumonia', u'nope', u'alters', u'consuming', u'affectionate', u'facade', u'consistency', u'peace', u'nice', u'eval', u'apple', u'tools', u'toy', u'baby', u'bent', u'allnighter', u'interviewees', u'reaffirm', u'wakes', u'highschool', u'impression', u'knowledge', u'words', u'joke', u'grail', u'wreck', u'party', u'usage', u's2xtra_wpao', u'acceptance', u'tight']"
25,"[u'adapt', u'attack', u'hygiene', u'allergies', u'lows', u'accounting', u'franco', u'soup', u'nonstop', u'factors', u'prehaps', u'butterflies', u'fml', u'sickness', u'throw', u'theoretically', u'taylor', u'tl', u'caffeine', u'phrase', u'needs', u'goal', u'okay', u'soccer', u'electives', u'province', u'find', u'admission', u'ide', u'garbage', u'hopes', u'wave', u'prescribe', u'mil', u'hs', u'lectures', u'overall', u'approval', u'tas', u'autism', u'expansion', u'stage', u'percent']"
26,"[u'relationships', u'whatnot', u'travel', u'writing', u'rater', u'jobmine', u'disaster', u'ambitions', u'outcome', u'child', u'core', u'rerouting', u'offer', u'approach', u'remember', u'ex', u'statistics', u'uwaterloo', u'sure', u'slot', u'review', u'label', u'reaction', u'cheery', u'touch', u'blow', u'blog', u'scholarships', u'journey', u'communication', u'nowadays', u'excuse', u'b', u'quote', u'hit', u'unsure', u'load', u'moderation', u'lawyers', u'preference', u'abilities', u'alternative', u'schoolwork', u'methods', u'decision', u'positions', u'race', u'havent', u'doubt', u'marrow', u'agenda', u'healthcare', u'backwards', u'fuckers', u'punish', u'counter', u'mechanism', u'handle', u'beat', u'comment', u'cousin', u'match', u'monday']"
27,"[u'suicidal', u'cakeday', u'calm', u'tinder', u'absolute', u'combination', u'chappelle', u'shame', u'thankfully', u'editor', u'existentialism', u'spurts', u'offense', u'write', u'online', u'colourfulskies97', u'corner', u'wiki', u'penthouse', u'quagmire', u'deeply', u'two', u'rather', u'terriblehack', u'actually', u'hackathon', u'older', u'heath', u'suite', u'breathing', u'challenge', u'bird', u'verity', u'lapse', u'varies', u'light', u'listless', u'deadlines', u'pointers', u'tenure', u'correlations', u'powder', u'drug', u'cirucmstances', u'turbulence', u'bud', u'deficiency', u'chance']"
28,"[u'secondly', u'street', u'schools', u'forgot', u'coding', u'coward', u'integrity', u'bam', u'extent', u'bothers', u'drugs', u'descent', u'pick', u'psych', u'officer', u'tennis', u'suspicions', u'bomber', u'could', u'wont', u'vote', u'hamsterdam', u'professionals', u'topics', u'notifications', u'region', u'strangers', u'streets', u'eye', u'recruiting', u'eigenvectors', u'discipline', u'files', u'lifespan', u'crop', u'outcomes', u'wander', u'inferiority', u'centre', u'bedroom', u'october', u'conditions', u'addition', u'podcasts', u'ofc', u'muscle', u'matcha', u'north', u'trials']"
29,"[u'chen', u'excellent', u'curiosity', u'earth', u'steam', u'peaks', u'thy', u'board', u'jennifer', u'motions', u'population', u'area', u'cbt', u'ten', u'transit', u'scientist', u'loopy', u'ncbi', u'vitamins', u'laurier', u'sobs', u'grind', u'cut', u'idk', u'opinion', u'infection', u'burden', u'lifestyle', u'space']"
30,"[u'path', u'stefani', u'fil', u'cmhr', u'assaults', u'troughs', u'o_o', u'wear', u'initiative', u'slc', u'item', u'freelance', u'excellence', u'optimism', u'cards', u'sport', u'ive', u'tendencies', u'grudge', u'decisions', u'good2talk', u'suffer', u'participants', u'w', u'algorithms', u'x', u'shower', u'ceca', u'sciatica', u'bonds', u'train', u'syndrome', u'physio', u'psychiatric', u'repercussions', u'combat', u'musks', u'key', u'nevertheless', u'oops', u'haul', u'desires']"
31,"[u'hermann', u'triumph', u'smoke', u'bro', u'brings', u'hurt', u'types', u'expectancy', u'silicon', u'minus', u'professor', u'spite', u'swindlers', u'triggers', u'medicating', u'slicepineapple', u'youre', u'claims', u'sentence', u'security', u'dollars', u'setting', u'soooo', u'sake', u'petition', u'james', u'quite', u'message', u'dare', u'nutrients', u'project', u'moves', u'neurotransmitters', u'mass', u'bandaids', u'screwdriver', u'backlash', u'texts', u'strategies', u'call', u'lookout', u'event', u'drifting', u'feet', u'coaster', u'afsa', u'kitchener', u'insane', u'icebreaker', u'spending', u'afford', u'meals', u'jist', u'congrats', u'pmc2908269', u'averages', u'youtubes', u'regions', u'thrill', u'hearthstone', u'qa', u'responses', u'otherwise', u'relevant', u'encouragement', u'member', u'details', u'extension', u'pd', u'ranks']"
32,"[u'christ', u'new', u'itunes', u'glhf', u'bucks', u'hearing', u'scenes', u'spectrum', u'highschooler', u'mcat', u'personality', u'countries', u'pregnancy', u'trigger', u'otherkins', u'here247', u'poser', u'toxic', u'wasting', u'avail', u'potato', u'classmate', u'graph', u'technique', u'passage', u'transportation', u'suicides', u'zarathustra', u'professors', u'pennylost12345', u'er', u'org', u'take', u'performance', u'clearer', u'stipulation', u'august', u'disappointment', u'poll', u'wake', u'everyday', u'improvement', u'pill', u'industry', u'compare', u'spreadsheet', u'banks', u'egg', u'labs', u'dons', u'bland', u'option', u'interviewer', u'begins', u'theorem', u'boys', u'illnesses', u'ibajinx', u'dealt', u'got', u'next', u'feminists', u'stabilizer', u'profile', u'watch', u'sit', u'struggles', u'books', u'crowdmark', u'counsellors', u'helplessness', u'sweat', u'fuckboy', u'mechanics', u'deaths']"
33,"[u'void', u'hundreds', u'dp', u'men', u'ill', u'wheel', u'emergencies', u'hear24', u'es', u'apples', u'aspects', u'pool', u'creatures', u'section', u'answers', u'vomit', u'tfw', u'depths', u'silence', u'long', u'mundane', u'slacker', u'rez', u'bring', u'strains', u'pits', u'weekends', u'implement', u'kinda']"
34,"[u'companies', u'shills', u'reports', u'jumping', u'cigarettes', u'keeps', u'thesis', u'revenge', u'ramblings', u'mud', u'ie', u'opportunity', u'stimuli', u'seasonal', u'highly', u'nerve', u'sticks', u'evidence', u'april', u'intramurals', u'honest', u'mindfulness', u'therapist', u'gaga', u'pox', u'boat', u'spice', u'calls', u'darkness', u'imagine', u'fees', u'sheer', u'useless', u'dependent', u'demons', u'reasons', u'maintenance', u'snap', u'info', u'rejection', u'anotha', u'looks', u'elusion', u'text', u'vent', u'present', u'reflection', u'diagnosis']"
35,"[u'adult', u'schemes', u'whining', u'manner', u'points', u'choooooo', u'stop', u'choice', u'tasks', u'impostors', u'cope', u'maturity', u'outside', u'cities', u'marking', u'weed', u'gonna', u'mondays', u'affection', u'darker', u'curve', u'opportunities', u'fam', u'ask', u'thread', u'sentences', u'majority', u'ugh', u'individual', u'pd2', u'distress', u'political', u'towns', u'kick', u'task', u'pomodoro', u'wanna', u'alarm', u'curb', u'deals', u'graduating', u'crap', u'courage', u'doesnt', u'data', u'regards', u'collaboration', u'humans', u'mech', u'wonders', u'predictor', u'chronic', u'june']"
36,"[u'interns', u'changes', u'plea', u'warm', u'bone', u'tried', u'bitter', u'plate', u'textbooks', u'habit', u'r', u'substance', u'calcium', u'seattle', u'trend', u'suggestion', u'bury', u'drama', u'applications', u'midnight', u'apron', u'lab', u'first', u'saw', u'successes', u'resentment', u'gist', u'oil', u'fruit', u'capability', u'stone', u'follow', u'sucks', u'venting', u'blood', u'thnx', u'evening', u'sentenc', u'truths', u'gender', u'pun', u'officers', u'play', u'culture', u'genes', u'c', u'fiance', u'community', u'flight', u'forgetting', u'indication', u'sight', u'link', u'fears', u'soul', u'experiment', u'manage', u'tact', u'seniors', u'fair', u'neet', u'tldr', u'instance', u'persistence', u'kipling', u'brink', u'regularly', u'grindstone', u'diversity', u'add', u'proofs', u'passion', u'frustration', u'ivory', u'bus', u'convince', u'lives']"
37,"[u'tech', u'verge', u'everybody', u'depressants', u'leases', u'eh', u'note', u'gone', u'compnay', u'distraction', u'source', u'sighs', u'isolation', u'tonight', u'movie']"
38,"[u'coast', u'fascination', u'finance', u'symbolism', u'shortcoming', u'github', u'visas', u'mate', u'portfolio']"
39,"[u'ups', u'schooling', u'circumstances', u'recovery', u'compassion', u'subsidized', u'academics', u'roommate', u'signing', u'allah', u'george', u'surprise', u'inferno', u'hangout', u'keyword', u'seep', u'situations', u'theme', u'meditate', u'release', u'disguise', u'shakes', u'dilemma', u'sunday', u'laundry', u'guys', u'receipt', u'happen', u'internet', u'e3', u'xd', u'engineer', u'oath', u'warriors', u'icon', u'walking', u'crime', u'freaking', u'reels', u'residence', u'slippery', u'stranger', u'always', u'nooo', u'fast', u'holes', u'abyss', u'sideprojects', u'quicker', u'mmm', u'pdfs', u'somebody', u'lifestyles', u'flashbacks', u'peeps', u'cups', u'base', u'terrible', u'probability', u'essays', u'lease', u'dealers', u'vidya', u'fluff', u'forgiveness', u'march', u'google', u'goddamn', u'stricken', u'commiseration', u'jumbo', u'vice', u'feridun', u'pieces', u'pig4', u'highs', u'glasses', u'lecture', u'lists', u'disease', u'btw', u'jog', u'puff', u'indica', u'thus', u'identity', u'bullshit', u'salaries', u'inbox', u'rule']"
40,"[u'spoke', u'root', u'pizza', u'victories', u'went', u'chugging', u'thx', u'bomb', u'nut', u'wikipedia', u'nightmares', u'uni', u'complex', u'background', u'bpd', u'dear', u'efforts', u'functions', u'stuck', u'excel', u'battle', u'feat', u'confidentiality', u'entrance', u'whenever', u'acknowledge', u'motherfuckers', u'doenst', u'breath', u'readings', u'interviewers', u'protein', u'harrigan55', u'tricks', u'edited', u'pretense', u'male', u'style', u'hires', u'physics', u'runescape', u'access', u'adulthood', u'attention', u'whole', u'engsoc', u'chatter', u'biking', u'stem', u'torture', u'seconds', u'survey', u'wallowing', u'mastery', u'aspiring', u'memes', u'interactions', u'embryology', u'tbh', u'joy', u'distribution', u'wtf', u'treat', u'fault', u'site', u'gap']"
41,"[u'every', u'halivera', u'tickets', u'niche', u'sju', u'experts', u'lay', u'fix', u'nietzsche', u'hopeless', u'dogs', u'took', u'came', u'compensation', u'catch', u'cons', u'left', u'cherry', u'comments', u'marketing', u'herpes', u'papers', u'memory', u'clue', u'reviews', u'cold', u'views', u'hall', u'furthermore', u'zuckerberg', u'emotion', u'ideal', u'stupid', u'parent', u'skew', u'ftfy', u'relief', u'honesty', u'kills', u'nose', u'edit2', u'chiro', u'ok', u'fraud', u'taste', u'woman', u'method', u'minor', u'v', u'minimum', u'salty', u'undergrads', u'playing', u'signs', u'researcher', u'might', u'weight', u'phil', u'bowen', u'mentality', u'reward', u'impact', u'courseload', u'enemy', u'dank', u'iron', u'geniuses', u'dominatrixes', u'grant', u'chris', u'chemistry', u'forward', u'wonton', u'algorithm', u'katy', u'helps', u'sir', u'hurdles', u'attend', u'fatigue', u'racist', u'institution', u'loves', u'bet', u'staff', u'piano', u'differs', u'heartbreaks', u'trinity', u'negligence', u'become', u'limitations', u'journal', u'sister', u'soudns', u'esteem']"
42,"[u'ever', u'credit', u'anime', u'ahaha', u'medications', u'sad', u'recover', u'outrage', u'employers', u'concert', u'buds', u'crush', u'solipsism', u'twenty', u'commiserate', u'reach', u'peanut', u'withdrawal', u'close', u'spawns', u'mississauga', u'thomson', u'prospects', u'ctci', u'library']"
43,"[u'crises', u'gratification', u'force', u'breathe', u'hi', u'mess', u'internalization', u'therecord', u'rat', u'shittiness', u'quit', u'preferences', u'advisors', u'talkers', u'folks', u'dr', u'irl', u'mum', u'hackerrank', u'incompetent', u'ariana', u'leaves', u'impediment', u'hunt', u'crowd', u'unmoving', u'dbt', u'congratulations', u'grateful', u'prom', u'discover', u'live', u'fortunately', u'spot', u'birds', u'catching', u'canada', u'monster', u'given', u'meme', u'shitpool', u'potential', u'hack', u'treasure', u'resource', u'reasonableness', u'cares', u'table', u'memories', u'girlfriend', u'fairness', u'reasoning', u'horror', u'fav', u'version', u'toxicity', u'homework', u'paragraph', u'comfort', u'hardwork', u'blunder', u'systems', u'yt', u'designation', u'alcohol', u'offline', u'client', u'obviously', u'exec', u'salaryman', u'cry', u'brush', u'see', u'knowing', u'prescription', u'copiers', u'depersonalization', u'hmmmmmm', u'kelly', u'organization', u'signals', u'suffering', u'line', u'an_open_letter_to_the_first_years', u'jump', u'wallet', u'cliques', u'snacks', u'britney', u'drops', u'proof', u'bones', u'rape', u'lines', u'physicians', u'tray', u'shell', u'mid', u'atmosphere', u'anyway', u'hopeful', u'insight', u'cycles', u'grad', u'ianal', u'headspace', u'almost', u'walks', u'vs', u'lunch', u'tmr', u'rudyard', u'van', u'housing', u'overtime', u'identities', u'portion']"
